|titulo|preco
0|Título: Ei, você!: Um livro sobre crescer com orgulho de ser negro|Preço: R$ 28,
1|Título: O incrível livro do Gildo|Preço: R$ 35,
2|Título: O Seminário, livro 11: Os quatro conceitos fundamentais da psicanálise|Preço: R$ 67,
3|Título: O livro laranja|Preço: R$ 35,
4|Título: É Assim que Acaba: 1|Preço: R$ 31,
5|Título: A Biblioteca da Meia-Noite|Preço: R$ 22,
6|Título: É assim que começa (Vol. 2 É assim que acaba)|Preço: R$ 29,
7|Título: #umdiasemreclamar: Descubra por que a gratidão pode mudar a sua vida|Preço: R$ 29,
8|Título: Todas as suas (im)perfeições|Preço: R$ 29,
9|Título: Box Receita Previsível (Livro 2ª edição + Workbook)|Preço: R$ 138,
10|Título: As coisas que você só vê quando desacelera: Como manter a calma em um mundo frenético|Preço: R$ 42,
11|Título: Mulheres que correm com os lobos: Mitos e histórias do arquétipo da Mulher Selvagem|Preço: R$ 37,
12|Título: Pai Rico, Pai Pobre - Edição de 20 anos atualizada e ampliada: O que os ricos ensinam a seus filhos sobre dinheiro|Preço: R$ 49,
13|Título: Daisy Jones and The Six: Uma história de amor e música|Preço: R$ 26,
14|Título: A psicologia financeira: lições atemporais sobre fortuna, ganância e felicidade|Preço: R$ 37,
15|"Título: Biblioteca Estoica | Grandes Mestres - Box com 4 livros"|Preço: R$ 49,
16|Título: Verity|Preço: R$ 29,
17|Título: A hipótese do amor: Sucesso do TikTok|Preço: R$ 29,
18|Título: A paciente silenciosa|Preço: R$ 35,
19|Título: Malibu renasce|Preço: R$ 34,
20|Título: Terra sonâmbula|Preço: R$ 26,
21|Título: Um rio chamado tempo, uma casa chamada terra|Preço: R$ 39,
22|Título: Os sete maridos de Evelyn Hugo|Preço: R$ 35,
23|Título: Daisy Jones and The Six: Uma história de amor e música|Preço: R$ 32,
24|Título: O livro que você gostaria que seus pais tivessem lido: (e seus filhos ficarão gratos por você ler)|Preço: R$ 39,
25|Título: Mindset: A nova psicologia do sucesso|Preço: R$ 32,
26|Título: A sutil arte de ligar o f*da-se|Preço: R$ 24,
27|Título: Torto arado|Preço: R$ 49,
28|Título: A princesa salva a si mesma neste livro|Preço: R$ 17,
29|Título: A vida invisível de Addie LaRue|Preço: R$ 37,
30|Título: A morte é um dia que vale a pena viver: E um excelente motivo para se buscar um novo olhar para a vida|Preço: R$ 25,
31|Título: Mentirosos – Sucesso no TikTok|Preço: R$ 23,
32|Título: O homem mais rico da Babilônia|Preço: R$ 22,
33|Título: A coragem de não agradar: Como a filosofia pode ajudar você a se libertar da opinião dos outros, superar suas limitações e se tornar a pessoa que deseja|Preço: R$ 35,
34|Título: Antes que o café esfrie|Preço: R$ 26,
35|Título: Até o verão terminar|Preço: R$ 29,
36|Título: Especialista em pessoas: Soluções bíblicas e inteligentes para lidar com todo tipo de gente|Preço: R$ 42,
37|Título: O médico e o monstro|Preço: R$ 13,
38|Título: O poder do hábito: Por que fazemos o que fazemos na vida e nos negócios|Preço: R$ 29,
39|Título: Mais esperto que o Diabo: O mistério revelado da liberdade e do sucesso|Preço: R$ 29,
40|Título: Essencialismo: A disciplinada busca por menos|Preço: R$ 45,
41|Título: Box Collen Hoover|Preço: R$ 80,
42|Título: A razão do amor (Sucesso do TikTok)|Preço: R$ 29,
43|Título: O Livro de Receitas de Harry Potter: Dos Bolos de Caldeirão à Cerveja Amanteigada – Mais de 150 receitas para bruxos e trouxas|Preço: R$ 82,
44|Título: Hábitos atômicos: Um método fácil e comprovado de criar bons hábitos e se livrar dos maus.|Preço: R$ 51,
45|Título: A revolução dos bichos: Um conto de fadas|Preço: R$ 11,
46|Título: De sangue e cinzas (Vol. 1)|Preço: R$ 9,
47|Título: Como fazer amigos e influenciar pessoas|Preço: R$ 41,
48|Título: Diário de uma ansiosa ou como parei de me sabotar: 1|Preço: R$ 23,
49|Título: Coraline - Acompanha Marcador de Páginas Especial|Preço: R$ 43,
50|Título: A gente mira no amor e acerta na solidão|Preço: R$ 29,
51|Título: Origem (Robert Langdon - Livro 5)|Preço: R$ 20,
52|Título: O projeto fênix – Edição comemorativa: um romance sobre TI, DevOps e sobre ajudar o seu negócio a vencer|Preço: R$ 58,
53|Título: Clube do Livro dos Homens (Clube do livro dos homens – Livro 1)|Preço: R$ 29,
54|Título: SPENCER - HERDEIROS DA MÁFIA - LIVRO 5|Preço: R$ 0,
55|Título: O nome do vento – Edição luxo (A Crônica do Matador do Rei – Livro 1)|Preço: R$ 59,
56|Título: O muro no meio do livro|Preço: R$ 33,
57|Título: Meu primeiro livro de contos de fadas|Preço: R$ 34,
58|Título: De passinho em passinho: Um livro para dançar e sonhar|Preço: R$ 24,
59|Título: Bendaora Vol. 01|Preço: R$ 27,
60|Título: O livro laranja|Preço: R$ 35,
61|Título: Um rio chamado tempo, uma casa chamada terra|Preço: R$ 39,
62|Título: Terra sonâmbula|Preço: R$ 26,
63|Título: Os sete maridos de Evelyn Hugo|Preço: R$ 35,
64|Título: O nome do vento – Edição luxo (A Crônica do Matador do Rei – Livro 1)|Preço: R$ 59,
65|Título: Salomão, o homem mais rico que já existiu: A sabedoria da Bíblia para uma vida plena e bem-sucedida|Preço: R$ 34,
66|Título: Amigos, amores e aquela coisa terrível|Preço: R$ 37,
67|Título: Hamlet|Preço: R$ 9,
68|Título: O morro dos ventos uivantes|Preço: R$ 12,
69|Título: Contos de fadas dos irmãos Grimm|Preço: R$ 14,
70|Título: CAFÉ COM DEUS PAI 2023|Preço: R$ 53,
71|Título: Romeu e Julieta|Preço: R$ 14,
72|Título: O Menino que Colecionava Frases: Frases para vida e status.|Preço: R$ 0,
73|Título: O diário de Anne Frank|Preço: R$ 18,
74|Título: Nação dopamina: Por que o excesso de prazer está nos deixando infelizes e o que podemos fazer para mudar|Preço: R$ 43,
75|Título: Saboroso Cadáver|Preço: R$ 41,
76|Título: Um perfeito cavalheiro – Edição Luxo (Os Bridgertons – Livro 3): O livro de Benedict|Preço: R$ 34,
77|Título: O sol é para todos|Preço: R$ 48,
78|Título: Manual de persuasão do FBI|Preço: R$ 37,
79|Título: Apologia De Sócrates|Preço: R$ 19,
80|Título: Daisy Jones and The Six: Uma história de amor e música|Preço: R$ 32,
81|Título: Blackout Vol. 2|Preço: R$ 15,
82|Título: Teerra & Windy - Edição Definitiva Vol. 01|Preço: R$ 27,
83|Título: Bendaora Vol. 01|Preço: R$ 27,
84|Título: Harry Potter e a Pedra Filosofal: 1|Preço: R$ 30,
85|Título: Os segredos da mente milionária: Aprenda a enriquecer mudando seus conceitos sobre o dinheiro e adotando os hábitos das pessoas bem-sucedidas|Preço: R$ 34,
86|Título: Drácula - Dark Edition: Edição limitada para caçadores de vampiros|Preço: R$ 64,
87|Título: Gatilhos Mentais: O Guia Completo com Estratégias de Negócios e Comunicações Provadas Para Você Aplicar|Preço: R$ 31,
88|Título: Nunca Saia Sozinho|Preço: R$ 22,
89|Título: Novembro, 9|Preço: R$ 31,
90|Título: Amor & Gelato: 1|Preço: R$ 29,
91|Título: O pequeno príncipe|Preço: R$ 16,
92|Título: O livro de ouro da mitologia: Histórias de deuses e heróis|Preço: R$ 23,
93|Título: Peter Pan - À Procura Do Livro Do Nunca|Preço: R$ 11,
94|Título: O livro da filosofia|Preço: R$ 52,
95|Título: Cartas de um diabo a seu aprendiz|Preço: R$ 34,
96|Título: O poder da ação - Edição Black: Faça sua vida ideal sair do papel e favorecendo a prosperidade|Preço: R$ 44,
97|Título: A fábrica de cretinos digitais: Os perigos das telas para nossas crianças|Preço: R$ 49,
98|Título: Livro + CD Milton Nascimento - Clube Da Esquina 2 Disco2|Preço: R$ 11,
99|Título: Luzes do Norte|Preço: R$ 37,
100|Título: O que sobra|Preço: R$ 39,
101|Título: Kit Grandes Contos Tolkien|Preço: R$ 100,
102|Título: Gente pobre|Preço: R$ 10,
103|Título: Dobre seus lucros: O livro de cabeceira de Marcel Telles, fundador da Ambev|Preço: R$ 29,
104|Título: Arrume a sua cama: Pequenas coisas que podem mudar a sua vida... E talvez o mundo|Preço: R$ 23,
105|Título: O melhor de mim: O primeiro amor deixa marcas para a vida inteira|Preço: R$ 26,
106|Título: Cristianismo puro e simples|Preço: R$ 34,
107|Título: Cura pelas palavras: da autora #1 do The New York Times|Preço: R$ 31,
108|Título: Como convencer alguém em 90 segundos: Crie uma primeira impressão vendedora|Preço: R$ 29,
109|Título: O rei dos dividendos: A saga do filho de imigrantes pobres que se tornou o maior investidor pessoa física da bolsa de valores brasileira|Preço: R$ 31,
110|Título: Coleção Anne De Green Gables - Kit Com 8 Livros|Preço: R$ 60,
111|Título: Vida a dois para sempre: As chaves para um casamento inabalável|Preço: R$ 29,
112|Título: De quanta terra precisa um homem? e outras histórias|Preço: R$ 11,
113|Título: O lado feio do amor|Preço: R$ 35,
114|Título: Atitude mental positiva|Preço: R$ 26,
115|Título: As 5 linguagens do amor das crianças - nova edição: Como expressar um compromisso de amor a seu filho|Preço: R$ 0,
116|Título: Como Fazer Mangá Vol. 01|Preço: R$ 21,
117|Título: The Flower Pot|Preço: R$ 42,
118|Título: Meu primeiro livro de contos de fadas|Preço: R$ 34,
119|Título: De passinho em passinho: Um livro para dançar e sonhar|Preço: R$ 24,
120|Título: O livro laranja|Preço: R$ 35,
121|Título: Terra sonâmbula|Preço: R$ 26,
122|Título: Um rio chamado tempo, uma casa chamada terra|Preço: R$ 39,
123|Título: Os sete maridos de Evelyn Hugo|Preço: R$ 35,
124|Título: O segredo|Preço: R$ 45,
125|Título: Sherlock Holmes - Um estudo em vermelho|Preço: R$ 14,
126|Título: Conceitos básicos sobre o Direito Internacional: Direito Internacional (Resumos para o CACD Livro 1)|Preço: R$ 0,
127|Título: Box Peter Pan: 3 livros + pôster + marcadores e Cards|Preço: R$ 57,
128|Título: O jardim das borboletas: Nem toda beleza será capturada|Preço: R$ 0,
129|Título: 1984: Edição com Postais + marcador|Preço: R$ 15,
130|Título: Bem lá no alto|Preço: R$ 31,
131|Título: Um milhão de finais felizes|Preço: R$ 23,
132|Título: Mau começo|Preço: R$ 19,
133|Título: O grande livro da mitologia Egípcia: Capa especial + marcador de páginas|Preço: R$ 22,
134|Título: Livro do desassossego|Preço: R$ 17,
135|Título: O Príncipe de Maquiavel: Texto Integral|Preço: R$ 19,
136|Título: Método Financeiro Do Primo Rico|Preço: R$ 29,
137|Título: The Book of Love|Preço: R$ 29,
138|Título: Livro de Colorir antiestresse: Mindfulness|Preço: R$ 14,
139|Título: Eu e Esse Meu Coração|Preço: R$ 35,
140|Título: Daisy Jones and The Six: Uma história de amor e música|Preço: R$ 32,
141|Título: O muro no meio do livro|Preço: R$ 33,
142|Título: Meu primeiro livro de contos de fadas|Preço: R$ 34,
143|Título: De passinho em passinho: Um livro para dançar e sonhar|Preço: R$ 24,
144|Título: 30 Minutos Para Mudar o Seu Dia|Preço: R$ 10,
145|Título: O Livro dos Espíritos: 14x21|Preço: R$ 17,
146|Título: Vendas não ocorrem por acaso: O guia de vendas da equipe comercial: Volume 1|Preço: R$ 44,
147|Título: 100 páginas para colorir – Disney – Meninas|Preço: R$ 12,
148|Título: Ler e colorir Contos Clássicos: Três Porquinhos, Os|Preço: R$ 1,
149|Título: Nos Braços do Pecado: Livro Único|Preço: R$ 0,
150|Título: Um verão em Paris|Preço: R$ 41,
151|Título: O grande livro de matemática do Manual do Mundo: Anotações incríveis e divertidas para você aprender sobre o intrigante universo dos números e das formas geométricas|Preço: R$ 67,
152|Título: Às vezes sou brisa, outras, ventania|Preço: R$ 35,
153|Título: Os grandes julgamentos da História|Preço: R$ 53,
154|Título: Liberte-se dos seus medos|Preço: R$ 38,
155|Título: Cartas de um diabo a seu aprendiz (Clássicos C. S. Lewis)|Preço: R$ 22,
156|Título: Coração acelerando|Preço: R$ 60,
157|Título: A velha loja de curiosidades - Kit com 2 livros|Preço: R$ 27,
158|Título: Quem pensa enriquece: Edição oficial e original de 1937|Preço: R$ 28,
159|Título: Terapia cognitivo-comportamental: teoria e prática|Preço: R$ 104,
160|Título: A pequena padaria do Brooklyn (Destinos Românticos – Livro 2)|Preço: R$ 36,
161|Título: Técnicas de Invasão: Aprenda as técnicas usadas por hackers em invasões reais|Preço: R$ 50,
162|Título: Resiliência: Como blindar a sua mente e conquistar a tranquilidade para resolver qualquer adversidade|Preço: R$ 21,
163|Título: ANSIEDADE: COMO ENFRENTAR O MAL DO SÉCULO|Preço: R$ 7,
164|Título: Le Petit – O livro do Bebê|Preço: R$ 103,
165|Título: A Mágica da Respiração: Um livro para aprender a lidar com raiva, frustração, tristeza e todos os outros sentimentos|Preço: R$ 26,
166|Título: Cocô, Xixi e Pum: Adeus, fralda!|Preço: R$ 35,
167|Título: O livro da literatura|Preço: R$ 38,
168|Título: Mundo das maravilhas: Um livro de colorir para os curiosos|Preço: R$ 24,
169|Título: Spare|Preço: R$ 195,
170|Título: O cristão surpreendente: Como os verdadeiros ﬁlhos de Deus vivem na terra|Preço: R$ 29,
171|Título: Através da minha janela Os irmãos Hidalgo – Vol. 1|Preço: R$ 19,
172|Título: O livro da Bíblia|Preço: R$ 35,
173|Título: O livro da biologia|Preço: R$ 55,
174|Título: O Livro Completo de Bruxaria de Raymon Buckland: Tradição, Rituais, Crenças, História e Prática|Preço: R$ 92,
175|Título: Coleção Selva Mágica + Oceano Perdido|Preço: R$ 47,
176|Título: O incrível livro do Gildo|Preço: R$ 35,
177|Título: Ei, você!: Um livro sobre crescer com orgulho de ser negro|Preço: R$ 28,
178|Título: O Seminário, livro 11: Os quatro conceitos fundamentais da psicanálise|Preço: R$ 67,
179|Título: Bendaora Vol. 01|Preço: R$ 27,
